{
  "annotation_version": "reference_annotation_v1",
  "validation_status": "confirmed",
  "source": "programmatic",
  "request_id": "prompt_001",
  "scene_type": "bedroom",
  "objects": [
    {
      "id": "obj_000",
      "category": "bed",
      "description": "tall red bed",
      "count": 1,
      "claim_state": "confirmed",
      "provenance": {
        "origin": "converter_draft",
        "object_plan_index": 0
      }
    },
    {
      "id": "obj_001",
      "category": "cabinet",
      "description": "dark wooden cabinet",
      "count": 1,
      "claim_state": "confirmed",
      "provenance": {
        "origin": "converter_draft",
        "object_plan_index": 1
      }
    },
    {
      "id": "obj_002",
      "category": "can",
      "description": "silver can",
      "count": 1,
      "claim_state": "confirmed",
      "provenance": {
        "origin": "converter_draft",
        "object_plan_index": 2
      }
    },
    {
      "id": "obj_003",
      "category": "lemon",
      "description": "yellow lemon",
      "count": 1,
      "claim_state": "confirmed",
      "provenance": {
        "origin": "converter_draft",
        "object_plan_index": 3
      }
    },
    {
      "id": "obj_004",
      "category": "spray bottle",
      "description": "white spray bottle",
      "count": 1,
      "claim_state": "confirmed",
      "provenance": {
        "origin": "converter_draft",
        "object_plan_index": 4
      }
    },
    {
      "id": "obj_005",
      "category": "sofa",
      "description": "brown leather sofa",
      "count": 1,
      "claim_state": "confirmed",
      "provenance": {
        "origin": "converter_draft",
        "object_plan_index": 5
      }
    },
    {
      "id": "obj_006",
      "category": "floor lamp",
      "description": "floor lamp",
      "count": 1,
      "claim_state": "confirmed",
      "provenance": {
        "origin": "converter_draft",
        "object_plan_index": 6
      }
    },
    {
      "id": "obj_007",
      "category": "pillow",
      "description": "light-grey pillow",
      "count": 1,
      "claim_state": "confirmed",
      "provenance": {
        "origin": "converter_draft",
        "object_plan_index": 7
      }
    },
    {
      "id": "obj_008",
      "category": "magazine",
      "description": "magazine",
      "count": 1,
      "claim_state": "confirmed",
      "provenance": {
        "origin": "converter_draft",
        "object_plan_index": 8
      }
    },
    {
      "id": "obj_009",
      "category": "art book",
      "description": "art book",
      "count": 1,
      "claim_state": "confirmed",
      "provenance": {
        "origin": "converter_draft",
        "object_plan_index": 9
      }
    }
  ],
  "oor_relations": [
    {
      "type": "immediately_left_of",
      "claim_state": "confirmed",
      "subject_id": "obj_001",
      "object_id": "obj_000"
    },
    {
      "type": "on_top_of",
      "claim_state": "confirmed",
      "subject_id": "obj_002",
      "object_id": "obj_001"
    },
    {
      "type": "on_top_of",
      "claim_state": "confirmed",
      "subject_id": "obj_003",
      "object_id": "obj_001"
    },
    {
      "type": "on_top_of",
      "claim_state": "confirmed",
      "subject_id": "obj_004",
      "object_id": "obj_001"
    },
    {
      "type": "left_of",
      "claim_state": "confirmed",
      "subject_id": "obj_002",
      "object_id": "obj_003"
    },
    {
      "type": "left_of",
      "claim_state": "confirmed",
      "subject_id": "obj_003",
      "object_id": "obj_004"
    },
    {
      "type": "opposite",
      "claim_state": "confirmed",
      "subject_id": "obj_005",
      "object_id": "obj_000"
    },
    {
      "type": "parallel_to",
      "claim_state": "confirmed",
      "subject_id": "obj_005",
      "object_id": "obj_000"
    },
    {
      "type": "at_head_of",
      "claim_state": "confirmed",
      "subject_id": "obj_007",
      "object_id": "obj_000"
    },
    {
      "type": "beside",
      "claim_state": "confirmed",
      "subject_id": "obj_008",
      "object_id": "obj_009"
    },
    {
      "type": "near",
      "claim_state": "confirmed",
      "subject_id": "obj_008",
      "object_id": "obj_005"
    },
    {
      "type": "near",
      "claim_state": "confirmed",
      "subject_id": "obj_009",
      "object_id": "obj_005"
    }
  ],
  "oar_relations": [
    {
      "subject_id": "obj_000",
      "type": "beside",
      "architectural_element": "east_wall",
      "claim_state": "confirmed"
    },
    {
      "subject_id": "obj_008",
      "type": "on",
      "architectural_element": "floor",
      "claim_state": "confirmed"
    },
    {
      "subject_id": "obj_009",
      "type": "on",
      "architectural_element": "floor",
      "claim_state": "confirmed"
    }
  ],
  "room_constraints": {
    "claim_state": "confirmed",
    "dimensions": {
      "width": 8.0,
      "depth": 8.0,
      "height": 2.8
    },
    "shape": "rectangular_enclosed_room"
  },
  "provenance": {
    "origin": "camera_pose14_calibration_fixture",
    "generator_visible": false,
    "leaderboard_ground_truth": false,
    "dropped_legacy_relations": [
      {
        "reason": "legacy_between_missing_two_anchor_ids",
        "relation": {
          "family": "oor",
          "subject_id": "obj_006",
          "type": "between",
          "object_id": "obj_005"
        }
      },
      {
        "reason": "legacy_between_missing_two_anchor_ids",
        "relation": {
          "family": "oar",
          "subject_id": "obj_006",
          "type": "between",
          "target": "west_wall"
        }
      }
    ]
  },
  "inventory_policy": "closed_world"
}
