{
  "annotation_version": "reference_annotation_v1",
  "validation_status": "confirmed",
  "source": "programmatic",
  "request_id": "prompt_010",
  "scene_type": "living_room",
  "objects": [
    {
      "id": "obj_000",
      "category": "sofa",
      "description": "light-grey L-shaped sectional",
      "count": 1,
      "claim_state": "confirmed",
      "provenance": {
        "origin": "converter_draft",
        "object_plan_index": 0
      }
    },
    {
      "id": "obj_001",
      "category": "table",
      "description": "square black coffee table",
      "count": 1,
      "claim_state": "confirmed",
      "provenance": {
        "origin": "converter_draft",
        "object_plan_index": 1
      }
    },
    {
      "id": "obj_002",
      "category": "bowl",
      "description": "red bowl",
      "count": 1,
      "claim_state": "confirmed",
      "provenance": {
        "origin": "converter_draft",
        "object_plan_index": 2
      }
    },
    {
      "id": "obj_003",
      "category": "magazine",
      "description": "closed magazine",
      "count": 1,
      "claim_state": "confirmed",
      "provenance": {
        "origin": "converter_draft",
        "object_plan_index": 3
      }
    },
    {
      "id": "obj_004",
      "category": "table",
      "description": "round side table",
      "count": 1,
      "claim_state": "confirmed",
      "provenance": {
        "origin": "converter_draft",
        "object_plan_index": 4
      }
    },
    {
      "id": "obj_005",
      "category": "lamp",
      "description": "table lamp",
      "count": 1,
      "claim_state": "confirmed",
      "provenance": {
        "origin": "converter_draft",
        "object_plan_index": 5
      }
    },
    {
      "id": "obj_006",
      "category": "television",
      "description": "large television",
      "count": 1,
      "claim_state": "confirmed",
      "provenance": {
        "origin": "converter_draft",
        "object_plan_index": 6
      }
    },
    {
      "id": "obj_007",
      "category": "plant",
      "description": "green plant",
      "count": 2,
      "claim_state": "confirmed",
      "provenance": {
        "origin": "converter_draft",
        "object_plan_index": 7
      }
    }
  ],
  "oor_relations": [
    {
      "type": "inside_open_side",
      "claim_state": "confirmed",
      "subject_id": "obj_001",
      "object_id": "obj_000"
    },
    {
      "type": "on_top_of",
      "claim_state": "confirmed",
      "subject_id": "obj_002",
      "object_id": "obj_001"
    },
    {
      "type": "on_top_of",
      "claim_state": "confirmed",
      "subject_id": "obj_003",
      "object_id": "obj_001"
    },
    {
      "type": "side_by_side",
      "claim_state": "confirmed",
      "subject_id": "obj_002",
      "object_id": "obj_003"
    },
    {
      "type": "near_short_end",
      "claim_state": "confirmed",
      "subject_id": "obj_004",
      "object_id": "obj_000"
    },
    {
      "type": "on_top_of",
      "claim_state": "confirmed",
      "subject_id": "obj_005",
      "object_id": "obj_004"
    },
    {
      "type": "symmetrically_below",
      "claim_state": "confirmed",
      "subject_id": "obj_007",
      "object_id": "obj_006"
    },
    {
      "type": "symmetrically_below",
      "claim_state": "confirmed",
      "subject_id": "obj_007",
      "object_id": "obj_006"
    }
  ],
  "oar_relations": [
    {
      "subject_id": "obj_000",
      "type": "in_corner",
      "architectural_element": "southwest_corner",
      "claim_state": "confirmed"
    },
    {
      "subject_id": "obj_000",
      "type": "against_wall",
      "architectural_element": "south_wall",
      "claim_state": "confirmed"
    },
    {
      "subject_id": "obj_000",
      "type": "against_wall",
      "architectural_element": "west_wall",
      "claim_state": "confirmed"
    },
    {
      "subject_id": "obj_006",
      "type": "mounted_on",
      "architectural_element": "north_wall",
      "claim_state": "confirmed"
    }
  ],
  "room_constraints": {
    "claim_state": "confirmed",
    "dimensions": {
      "width": 8.0,
      "depth": 9.0,
      "height": 3.0
    },
    "shape": "rectangular_enclosed_room"
  },
  "provenance": {
    "origin": "camera_pose14_calibration_fixture",
    "generator_visible": false,
    "leaderboard_ground_truth": false,
    "dropped_legacy_relations": []
  },
  "inventory_policy": "closed_world"
}
