{
  "annotation_version": "reference_annotation_v1",
  "validation_status": "confirmed",
  "source": "programmatic",
  "request_id": "easy_003",
  "scene_type": "home_office",
  "objects": [
    {
      "id": "obj_000",
      "category": "desk",
      "description": "dark angular wooden desk",
      "count": 1,
      "claim_state": "confirmed",
      "provenance": {
        "origin": "converter_draft",
        "object_plan_index": 0
      }
    },
    {
      "id": "obj_001",
      "category": "monitor",
      "description": "dark gray flat screen monitor",
      "count": 1,
      "claim_state": "confirmed",
      "provenance": {
        "origin": "converter_draft",
        "object_plan_index": 1
      }
    },
    {
      "id": "obj_002",
      "category": "chair",
      "description": "dark brown wooden chair",
      "count": 1,
      "claim_state": "confirmed",
      "provenance": {
        "origin": "converter_draft",
        "object_plan_index": 2
      }
    },
    {
      "id": "obj_003",
      "category": "shelf",
      "description": "light wood five tier shelf",
      "count": 1,
      "claim_state": "confirmed",
      "provenance": {
        "origin": "converter_draft",
        "object_plan_index": 3
      }
    },
    {
      "id": "obj_004",
      "category": "cup",
      "description": "white ceramic cup",
      "count": 1,
      "claim_state": "confirmed",
      "provenance": {
        "origin": "converter_draft",
        "object_plan_index": 4
      }
    }
  ],
  "oor_relations": [
    {
      "type": "on_top_of",
      "claim_state": "confirmed",
      "subject_id": "obj_001",
      "object_id": "obj_000"
    },
    {
      "type": "in_front_of",
      "claim_state": "confirmed",
      "subject_id": "obj_002",
      "object_id": "obj_000"
    },
    {
      "type": "left_of",
      "claim_state": "confirmed",
      "subject_id": "obj_003",
      "object_id": "obj_000"
    },
    {
      "type": "right_of",
      "claim_state": "confirmed",
      "subject_id": "obj_004",
      "object_id": "obj_001"
    },
    {
      "type": "on_top_of",
      "claim_state": "confirmed",
      "subject_id": "obj_004",
      "object_id": "obj_000"
    }
  ],
  "oar_relations": [
    {
      "subject_id": "obj_000",
      "type": "against_wall",
      "architectural_element": "north_wall",
      "claim_state": "confirmed"
    }
  ],
  "room_constraints": {
    "claim_state": "not_mentioned"
  },
  "provenance": {
    "origin": "camera_pose14_calibration_fixture",
    "generator_visible": false,
    "leaderboard_ground_truth": false,
    "dropped_legacy_relations": []
  },
  "inventory_policy": "closed_world"
}
