{
  "annotation_version": "reference_annotation_v1",
  "validation_status": "confirmed",
  "source": "programmatic",
  "request_id": "prompt_005",
  "scene_type": "children_bedroom",
  "objects": [
    {
      "id": "obj_000",
      "category": "bunk_bed",
      "description": "white bunk bed",
      "count": 1,
      "claim_state": "confirmed",
      "provenance": {
        "origin": "converter_draft",
        "object_plan_index": 0
      }
    },
    {
      "id": "obj_001",
      "category": "desk",
      "description": "blue desk",
      "count": 1,
      "claim_state": "confirmed",
      "provenance": {
        "origin": "converter_draft",
        "object_plan_index": 1
      }
    },
    {
      "id": "obj_002",
      "category": "chair",
      "description": "yellow chair",
      "count": 1,
      "claim_state": "confirmed",
      "provenance": {
        "origin": "converter_draft",
        "object_plan_index": 2
      }
    },
    {
      "id": "obj_003",
      "category": "laptop",
      "description": "laptop",
      "count": 1,
      "claim_state": "confirmed",
      "provenance": {
        "origin": "converter_draft",
        "object_plan_index": 3
      }
    },
    {
      "id": "obj_004",
      "category": "book",
      "description": "closed book",
      "count": 2,
      "claim_state": "confirmed",
      "provenance": {
        "origin": "converter_draft",
        "object_plan_index": 4
      }
    },
    {
      "id": "obj_005",
      "category": "shelf",
      "description": "shelf",
      "count": 1,
      "claim_state": "confirmed",
      "provenance": {
        "origin": "converter_draft",
        "object_plan_index": 5
      }
    },
    {
      "id": "obj_006",
      "category": "toy_box",
      "description": "toy box",
      "count": 3,
      "claim_state": "confirmed",
      "provenance": {
        "origin": "converter_draft",
        "object_plan_index": 6
      }
    },
    {
      "id": "obj_007",
      "category": "floor_lamp",
      "description": "red floor lamp",
      "count": 1,
      "claim_state": "confirmed",
      "provenance": {
        "origin": "converter_draft",
        "object_plan_index": 7
      }
    },
    {
      "id": "obj_008",
      "category": "rug",
      "description": "round green rug",
      "count": 1,
      "claim_state": "confirmed",
      "provenance": {
        "origin": "converter_draft",
        "object_plan_index": 8
      }
    }
  ],
  "oor_relations": [
    {
      "type": "in_front_of",
      "claim_state": "confirmed",
      "subject_id": "obj_002",
      "object_id": "obj_001"
    },
    {
      "type": "on_top_of",
      "claim_state": "confirmed",
      "subject_id": "obj_003",
      "object_id": "obj_001"
    },
    {
      "type": "on_top_of",
      "claim_state": "confirmed",
      "subject_id": "obj_004",
      "object_id": "obj_001"
    },
    {
      "type": "below",
      "claim_state": "confirmed",
      "subject_id": "obj_006",
      "object_id": "obj_005"
    },
    {
      "type": "side_by_side",
      "claim_state": "confirmed",
      "subject_id": "obj_006",
      "object_id": "obj_006"
    },
    {
      "type": "beside",
      "claim_state": "confirmed",
      "subject_id": "obj_007",
      "object_id": "obj_000"
    }
  ],
  "oar_relations": [
    {
      "subject_id": "obj_000",
      "type": "against_wall",
      "architectural_element": "west_wall",
      "claim_state": "confirmed"
    },
    {
      "subject_id": "obj_001",
      "type": "against_wall",
      "architectural_element": "east_wall",
      "claim_state": "confirmed"
    },
    {
      "subject_id": "obj_005",
      "type": "mounted_on_wall",
      "architectural_element": "east_wall",
      "claim_state": "confirmed"
    }
  ],
  "room_constraints": {
    "claim_state": "confirmed",
    "dimensions": {
      "width": 7.0,
      "depth": 7.0,
      "height": 2.8
    },
    "shape": "rectangular_enclosed_room"
  },
  "provenance": {
    "origin": "camera_pose14_calibration_fixture",
    "generator_visible": false,
    "leaderboard_ground_truth": false,
    "dropped_legacy_relations": [
      {
        "reason": "legacy_between_missing_two_anchor_ids",
        "relation": {
          "family": "oor",
          "subject_id": "obj_003",
          "type": "between",
          "object_id": "obj_004"
        }
      },
      {
        "reason": "legacy_between_missing_two_anchor_ids",
        "relation": {
          "family": "oor",
          "subject_id": "obj_008",
          "type": "between",
          "object_id": "obj_000"
        }
      },
      {
        "reason": "legacy_between_missing_two_anchor_ids",
        "relation": {
          "family": "oor",
          "subject_id": "obj_008",
          "type": "between",
          "object_id": "obj_001"
        }
      }
    ]
  },
  "inventory_policy": "closed_world"
}
