{
  "annotation_version": "reference_annotation_v1",
  "validation_status": "confirmed",
  "source": "manual",
  "request_id": "ablation_easy_002",
  "scene_type": "living_room",
  "inventory_policy": "closed_world",
  "objects": [
    {"id": "obj_000", "category": "sofa", "description": "brown leather chesterfield sofa", "count": 1, "claim_state": "confirmed"},
    {"id": "obj_001", "category": "table", "description": "dark wood coffee table", "count": 1, "claim_state": "confirmed"},
    {"id": "obj_002", "category": "vase", "description": "white ceramic vase", "count": 1, "claim_state": "confirmed"},
    {"id": "obj_003", "category": "rug", "description": "deep red floral carpet", "count": 1, "claim_state": "confirmed"},
    {"id": "obj_004", "category": "lamp", "description": "dark gray angular floor lamp", "count": 1, "claim_state": "confirmed"}
  ],
  "oor_relations": [
    {"type": "in_front", "subject_id": "obj_001", "object_id": "obj_000", "claim_state": "confirmed"},
    {"type": "parallel", "subject_id": "obj_001", "object_id": "obj_000", "claim_state": "confirmed"},
    {"type": "on_top_of", "subject_id": "obj_002", "object_id": "obj_001", "claim_state": "confirmed"},
    {"type": "in_front", "subject_id": "obj_003", "object_id": "obj_000", "claim_state": "confirmed"},
    {"type": "right", "subject_id": "obj_004", "object_id": "obj_000", "claim_state": "confirmed"}
  ],
  "oar_relations": [
    {"type": "against_wall", "subject_id": "obj_000", "architectural_element": "west_wall", "claim_state": "confirmed"},
    {"type": "on_floor", "subject_id": "obj_003", "architectural_element": "floor", "claim_state": "confirmed"}
  ],
  "room_constraints": {"claim_state": "not_mentioned"},
  "provenance": {"origin": "manual_p0b_ablation_conversion", "generator_visible": false, "leaderboard_ground_truth": false, "room_source": "benchmark_fallback"}
}
