{
  "annotation_version": "reference_annotation_v1",
  "validation_status": "confirmed",
  "source": "programmatic",
  "request_id": "prompt_027",
  "scene_type": "kitchen",
  "objects": [
    {
      "id": "obj_000",
      "category": "island",
      "description": "long grey island",
      "count": 1,
      "claim_state": "confirmed",
      "provenance": {
        "origin": "converter_draft",
        "object_plan_index": 0
      }
    },
    {
      "id": "obj_001",
      "category": "stool",
      "description": "black stool",
      "count": 3,
      "claim_state": "confirmed",
      "provenance": {
        "origin": "converter_draft",
        "object_plan_index": 1
      }
    },
    {
      "id": "obj_002",
      "category": "sink",
      "description": "sink",
      "count": 1,
      "claim_state": "confirmed",
      "provenance": {
        "origin": "converter_draft",
        "object_plan_index": 2
      }
    },
    {
      "id": "obj_003",
      "category": "cooktop",
      "description": "cooktop",
      "count": 1,
      "claim_state": "confirmed",
      "provenance": {
        "origin": "converter_draft",
        "object_plan_index": 3
      }
    },
    {
      "id": "obj_004",
      "category": "cutting_board",
      "description": "cutting board",
      "count": 1,
      "claim_state": "confirmed",
      "provenance": {
        "origin": "converter_draft",
        "object_plan_index": 4
      }
    },
    {
      "id": "obj_005",
      "category": "kettle",
      "description": "red kettle",
      "count": 1,
      "claim_state": "confirmed",
      "provenance": {
        "origin": "converter_draft",
        "object_plan_index": 5
      }
    },
    {
      "id": "obj_006",
      "category": "refrigerator",
      "description": "refrigerator",
      "count": 1,
      "claim_state": "confirmed",
      "provenance": {
        "origin": "converter_draft",
        "object_plan_index": 6
      }
    },
    {
      "id": "obj_007",
      "category": "cabinet",
      "description": "tall pantry cabinet",
      "count": 1,
      "claim_state": "confirmed",
      "provenance": {
        "origin": "converter_draft",
        "object_plan_index": 7
      }
    },
    {
      "id": "obj_008",
      "category": "counter",
      "description": "counter",
      "count": 1,
      "claim_state": "confirmed",
      "provenance": {
        "origin": "converter_draft",
        "object_plan_index": 8
      }
    },
    {
      "id": "obj_009",
      "category": "toaster",
      "description": "toaster",
      "count": 1,
      "claim_state": "confirmed",
      "provenance": {
        "origin": "converter_draft",
        "object_plan_index": 9
      }
    },
    {
      "id": "obj_010",
      "category": "cabinet",
      "description": "wall cabinet",
      "count": 2,
      "claim_state": "confirmed",
      "provenance": {
        "origin": "converter_draft",
        "object_plan_index": 10
      }
    },
    {
      "id": "obj_011",
      "category": "waste_bin",
      "description": "waste bin",
      "count": 1,
      "claim_state": "confirmed",
      "provenance": {
        "origin": "converter_draft",
        "object_plan_index": 11
      }
    }
  ],
  "oor_relations": [
    {
      "type": "arranged_along_side",
      "claim_state": "confirmed",
      "subject_id": "obj_001",
      "object_id": "obj_000"
    },
    {
      "type": "at_left_end",
      "claim_state": "confirmed",
      "subject_id": "obj_002",
      "object_id": "obj_000"
    },
    {
      "type": "at_right_end",
      "claim_state": "confirmed",
      "subject_id": "obj_003",
      "object_id": "obj_000"
    },
    {
      "type": "behind",
      "claim_state": "confirmed",
      "subject_id": "obj_005",
      "object_id": "obj_004"
    },
    {
      "type": "beside",
      "claim_state": "confirmed",
      "subject_id": "obj_007",
      "object_id": "obj_006"
    },
    {
      "type": "on",
      "claim_state": "confirmed",
      "subject_id": "obj_009",
      "object_id": "obj_008"
    },
    {
      "type": "above",
      "claim_state": "confirmed",
      "subject_id": "obj_010",
      "object_id": "obj_008"
    }
  ],
  "oar_relations": [
    {
      "subject_id": "obj_000",
      "type": "centered_in_room",
      "architectural_element": "floor",
      "claim_state": "confirmed"
    },
    {
      "subject_id": "obj_006",
      "type": "against_wall",
      "architectural_element": "north_wall",
      "claim_state": "confirmed"
    },
    {
      "subject_id": "obj_008",
      "type": "along_wall",
      "architectural_element": "east_wall",
      "claim_state": "confirmed"
    }
  ],
  "room_constraints": {
    "claim_state": "confirmed",
    "dimensions": {
      "width": 9.0,
      "depth": 8.0,
      "height": 3.0
    },
    "shape": "rectangular_enclosed_room"
  },
  "provenance": {
    "origin": "camera_pose14_calibration_fixture",
    "generator_visible": false,
    "leaderboard_ground_truth": false,
    "dropped_legacy_relations": [
      {
        "reason": "legacy_between_missing_two_anchor_ids",
        "relation": {
          "family": "oor",
          "subject_id": "obj_004",
          "type": "between",
          "object_id": "obj_002"
        }
      },
      {
        "reason": "legacy_between_missing_two_anchor_ids",
        "relation": {
          "family": "oor",
          "subject_id": "obj_004",
          "type": "between",
          "object_id": "obj_003"
        }
      },
      {
        "reason": "legacy_between_missing_two_anchor_ids",
        "relation": {
          "family": "oar",
          "subject_id": "obj_011",
          "type": "between",
          "target": "west_wall"
        }
      },
      {
        "reason": "legacy_between_missing_two_anchor_ids",
        "relation": {
          "family": "oar",
          "subject_id": "obj_011",
          "type": "between",
          "target": "obj_000"
        }
      }
    ]
  },
  "inventory_policy": "closed_world"
}
