{
  "annotation_version": "reference_annotation_v1",
  "validation_status": "confirmed",
  "source": "manual",
  "request_id": "source_clean_004__support",
  "scene_type": "kitchen",
  "inventory_policy": "closed_world",
  "objects": [
    {
      "id": "obj_000",
      "category": "cabinet",
      "description": "light wood kitchen cabinet",
      "count": 1,
      "claim_state": "confirmed"
    },
    {
      "id": "obj_001",
      "category": "refrigerator",
      "description": "white rounded refrigerator",
      "count": 1,
      "claim_state": "confirmed"
    },
    {
      "id": "obj_002",
      "category": "cabinet",
      "description": "light wood kitchen cabinet",
      "count": 1,
      "claim_state": "confirmed"
    },
    {
      "id": "obj_003",
      "category": "cabinet",
      "description": "dark wooden kitchen cabinet",
      "count": 1,
      "claim_state": "confirmed"
    },
    {
      "id": "obj_004",
      "category": "cabinet",
      "description": "dark wooden kitchen cabinet",
      "count": 1,
      "claim_state": "confirmed"
    },
    {
      "id": "obj_005",
      "category": "cabinet",
      "description": "dark wooden kitchen cabinet",
      "count": 1,
      "claim_state": "confirmed"
    }
  ],
  "oor_relations": [
    {
      "type": "near",
      "subject_id": "obj_002",
      "object_id": "obj_000",
      "claim_state": "confirmed",
      "relation_id": "oor_000"
    },
    {
      "type": "aligned",
      "subject_id": "obj_002",
      "object_id": "obj_000",
      "axis": "x",
      "claim_state": "confirmed",
      "relation_id": "oor_001"
    },
    {
      "type": "near",
      "subject_id": "obj_003",
      "object_id": "obj_005",
      "claim_state": "confirmed",
      "relation_id": "oor_002"
    }
  ],
  "oar_relations": [
    {
      "type": "at_corner",
      "subject_id": "obj_001",
      "architectural_element": "southwest_corner",
      "claim_state": "confirmed",
      "relation_id": "oar_000"
    },
    {
      "type": "against_wall",
      "subject_id": "obj_003",
      "architectural_element": "south_wall",
      "claim_state": "confirmed",
      "relation_id": "oar_001"
    },
    {
      "type": "against_wall",
      "subject_id": "obj_004",
      "architectural_element": "east_wall",
      "claim_state": "confirmed",
      "relation_id": "oar_002"
    },
    {
      "type": "room_region",
      "subject_id": "obj_000",
      "architectural_element": "north_region",
      "region": "north",
      "claim_state": "confirmed",
      "relation_id": "oar_003"
    },
    {
      "type": "room_region",
      "subject_id": "obj_002",
      "architectural_element": "north_region",
      "region": "north",
      "claim_state": "confirmed",
      "relation_id": "oar_004"
    }
  ],
  "room_constraints": {
    "claim_state": "confirmed",
    "shape": "rectangular_enclosed_room",
    "dimensions": {
      "width": 2.64,
      "depth": 3.29,
      "height": 2.3998
    }
  },
  "review": {
    "status": "approved",
    "reviewer": "benchmark_author"
  },
  "provenance": {
    "origin": "manual_source_scene_fixture_conversion",
    "generator_visible": false,
    "leaderboard_ground_truth": false,
    "source_scene_id": "scene_003609_02",
    "base_case_id": "source_clean_004",
    "variant_family": "support"
  }
}
