{
  "annotation_version": "reference_annotation_v1",
  "validation_status": "confirmed",
  "source": "programmatic",
  "request_id": "prompt_022",
  "scene_type": "library",
  "objects": [
    {
      "id": "obj_000",
      "category": "bookcase",
      "description": "long bookcase",
      "count": 1,
      "claim_state": "confirmed",
      "provenance": {
        "origin": "converter_draft",
        "object_plan_index": 0
      }
    },
    {
      "id": "obj_001",
      "category": "bookcase",
      "description": "long bookcase",
      "count": 1,
      "claim_state": "confirmed",
      "provenance": {
        "origin": "converter_draft",
        "object_plan_index": 1
      }
    },
    {
      "id": "obj_002",
      "category": "table",
      "description": "rectangular study table",
      "count": 3,
      "claim_state": "confirmed",
      "provenance": {
        "origin": "converter_draft",
        "object_plan_index": 2
      }
    },
    {
      "id": "obj_003",
      "category": "chair",
      "description": "standard chair",
      "count": 6,
      "claim_state": "confirmed",
      "provenance": {
        "origin": "converter_draft",
        "object_plan_index": 3
      }
    },
    {
      "id": "obj_004",
      "category": "lamp",
      "description": "green reading lamp",
      "count": 3,
      "claim_state": "confirmed",
      "provenance": {
        "origin": "converter_draft",
        "object_plan_index": 4
      }
    },
    {
      "id": "obj_005",
      "category": "book",
      "description": "upright book",
      "count": 4,
      "claim_state": "confirmed",
      "provenance": {
        "origin": "converter_draft",
        "object_plan_index": 5
      }
    },
    {
      "id": "obj_006",
      "category": "desk",
      "description": "librarian desk",
      "count": 1,
      "claim_state": "confirmed",
      "provenance": {
        "origin": "converter_draft",
        "object_plan_index": 6
      }
    },
    {
      "id": "obj_007",
      "category": "chair",
      "description": "chair behind librarian desk",
      "count": 1,
      "claim_state": "confirmed",
      "provenance": {
        "origin": "converter_draft",
        "object_plan_index": 7
      }
    },
    {
      "id": "obj_008",
      "category": "cart",
      "description": "book return cart",
      "count": 1,
      "claim_state": "confirmed",
      "provenance": {
        "origin": "converter_draft",
        "object_plan_index": 8
      }
    }
  ],
  "oor_relations": [
    {
      "type": "adjacent_to",
      "claim_state": "confirmed",
      "subject_id": "obj_003",
      "object_id": "obj_002"
    },
    {
      "type": "on_top_of",
      "claim_state": "confirmed",
      "subject_id": "obj_004",
      "object_id": "obj_002"
    },
    {
      "type": "on_shelf_of",
      "claim_state": "confirmed",
      "subject_id": "obj_005",
      "object_id": "obj_000"
    },
    {
      "type": "behind",
      "claim_state": "confirmed",
      "subject_id": "obj_007",
      "object_id": "obj_006"
    },
    {
      "type": "beside",
      "claim_state": "confirmed",
      "subject_id": "obj_008",
      "object_id": "obj_006"
    }
  ],
  "oar_relations": [
    {
      "subject_id": "obj_000",
      "type": "against_wall",
      "architectural_element": "west_wall",
      "claim_state": "confirmed"
    },
    {
      "subject_id": "obj_001",
      "type": "against_wall",
      "architectural_element": "east_wall",
      "claim_state": "confirmed"
    },
    {
      "subject_id": "obj_002",
      "type": "parallel_to",
      "architectural_element": "west_wall",
      "claim_state": "confirmed"
    },
    {
      "subject_id": "obj_002",
      "type": "centered_on",
      "architectural_element": "floor",
      "claim_state": "confirmed"
    },
    {
      "subject_id": "obj_006",
      "type": "near",
      "architectural_element": "south_wall",
      "claim_state": "confirmed"
    }
  ],
  "room_constraints": {
    "claim_state": "confirmed",
    "dimensions": {
      "width": 12.0,
      "depth": 9.0,
      "height": 3.5
    },
    "shape": "rectangular_enclosed_room"
  },
  "provenance": {
    "origin": "camera_pose14_calibration_fixture",
    "generator_visible": false,
    "leaderboard_ground_truth": false,
    "dropped_legacy_relations": []
  },
  "inventory_policy": "closed_world"
}
